<?xml version="1.0"?>
<xs:schema xmlns:xs="http://www.w3.org/2001/XMLSchema"
	attributeFormDefault="unqualified" elementFormDefault="qualified"
    xmlns:vc="http://www.w3.org/2007/XMLSchema-versioning" vc:minVersion="1.1">
	<xs:element name="story" type="storyType" />
	<xs:complexType name="characterType">
		<xs:sequence>
			<xs:element type="xs:int" name="health" />
			<xs:element type="xs:int" name="defense" />
			<xs:element type="xs:int" name="skill" />
			<xs:element type="xs:int" name="luck" />
		</xs:sequence>
		<xs:attribute type="xs:int" name="position" use="required">
			<xs:annotation>
				<xs:documentation>Start section position of character
				</xs:documentation>
			</xs:annotation>
		</xs:attribute>
		<xs:attribute type="xs:int" name="id" use="required" />
		<xs:attribute type="xs:string" name="name" use="required">
			<xs:annotation>
				<xs:documentation>Name of character</xs:documentation>
			</xs:annotation>
		</xs:attribute>
		<xs:attribute type="xs:string" name="description" use="required">
			<xs:annotation>
				<xs:documentation>Description of character</xs:documentation>
			</xs:annotation>
		</xs:attribute>
	</xs:complexType>
	<xs:complexType name="charactersType">
		<xs:sequence>
			<xs:element type="characterType" name="character" maxOccurs="unbounded" minOccurs="0"/>
		</xs:sequence>
	</xs:complexType>
	<xs:complexType name="bonusType">
		<xs:simpleContent>
			<xs:extension base="xs:string">
				<xs:attribute type="xs:string" name="type" use="optional" />
				<xs:attribute type="xs:int" name="value" use="optional" />
				<xs:attribute type="xs:string" name="debuff" use="optional" />
				<xs:attribute type="xs:string" name="state" use="optional" />
				<xs:attribute type="xs:string" name="overflowed" use="optional" />
			</xs:extension>
		</xs:simpleContent>
	</xs:complexType>
	<xs:complexType name="bonusesType">
		<xs:sequence>
			<xs:element type="bonusType" name="bonus" maxOccurs="unbounded"
				minOccurs="0" />
		</xs:sequence>
	</xs:complexType>
	<xs:complexType name="enemyType">
		<xs:simpleContent>
			<xs:extension base="xs:string">
				<xs:attribute type="xs:int" name="attack" use="required" />
				<xs:attribute type="xs:int" name="skill" use="required" />
				<xs:attribute type="xs:string" name="name" use="required" />
				<xs:attribute type="xs:string" name="fightWithoutDamageText"
					use="optional">
					<xs:annotation>
						<xs:documentation>Text will shown when character's health is not
							affected by enemy. Text is android string reference and must have format "@string/text".</xs:documentation>
					</xs:annotation>
				</xs:attribute>
				<xs:attribute type="xs:string" name="fightWithDamageText"
					use="optional">
					<xs:annotation>
						<xs:documentation>Text will shown when character's health is
							affected by enemy. Text is android string reference and must have format "@string/text".</xs:documentation>
					</xs:annotation>
				</xs:attribute>
				<xs:attribute type="xs:string" name="fightSkillText"
					use="optional">
					<xs:annotation>
						<xs:documentation>Text will shown when character's skill is
							greater then enemy skill. Text is android string reference and must have format "@string/text".</xs:documentation>
					</xs:annotation>
				</xs:attribute>
				<xs:attribute type="xs:string" name="fightLoseText"
					use="optional">
					<xs:annotation>
						<xs:documentation>Text will shown when character is defeated by
							enemy. Text is android string reference and must have format "@string/text".</xs:documentation>
					</xs:annotation>
				</xs:attribute>
				<xs:attribute type="xs:string" name="fightLuckText"
					use="optional">
					<xs:annotation>
						<xs:documentation>Text will shown when character has luck in fight
							with enemy. Text is android string reference and must have format "@string/text".</xs:documentation>
					</xs:annotation>
				</xs:attribute>
			</xs:extension>
		</xs:simpleContent>
	</xs:complexType>
	<xs:complexType name="enemiesType">
		<xs:sequence>
			<xs:element type="enemyType" name="enemy" maxOccurs="unbounded"
				minOccurs="0" />
		</xs:sequence>
	</xs:complexType>
	<xs:complexType name="optionType">
		<xs:simpleContent>
			<xs:extension base="xs:string">
				<xs:attribute type="xs:int" name="section" use="required">
					<xs:annotation>
						<xs:documentation>Position of next section.</xs:documentation>
					</xs:annotation>
				</xs:attribute>
				<xs:attribute type="xs:string" name="text" use="required">
					<xs:annotation>
						<xs:documentation>Text is android string reference and must have format "@string/text".</xs:documentation>
					</xs:annotation>
				</xs:attribute>
			</xs:extension>
		</xs:simpleContent>
	</xs:complexType>
	<xs:complexType name="optionsType">
		<xs:sequence>
			<xs:element type="optionType" name="option" maxOccurs="unbounded"/>
		</xs:sequence>
	</xs:complexType>
	<xs:complexType name="sectionType" mixed="true">
		<xs:sequence>
			<xs:element type="bonusesType" name="bonuses" minOccurs="0" />
			<xs:element type="enemiesType" name="enemies" minOccurs="0" />
			<xs:element type="optionsType" name="options" minOccurs="0" />
		</xs:sequence>
		<xs:attribute type="xs:int" name="position" use="required" />
		<xs:attribute type="xs:string" name="text" use="required">
			<xs:annotation>
				<xs:documentation>Part of text of story. Text is android string reference and must have format "@string/text".</xs:documentation>
			</xs:annotation>
		</xs:attribute>
		<xs:attribute type="xs:string" name="enemiesDefeatedText"
			use="optional">
			<xs:annotation>
				<xs:documentation>Text will shown when player defeated all enemies
					(this is required when enemies are defined). Text is android string reference and must have format "@string/text".</xs:documentation>
			</xs:annotation>
		</xs:attribute>
		<xs:attribute type="xs:string" name="luckText" use="optional">
			<xs:annotation>
				<xs:documentation>Text will shown when player has luck and avoid
					combat. Text is android string reference and must have format "@string/text".</xs:documentation>
			</xs:annotation>
		</xs:attribute>
		<xs:attribute type="xs:string" name="endGame" use="optional">
			<xs:annotation>
				<xs:documentation>Indicates this is end of game (last section).
				</xs:documentation>
			</xs:annotation>
		</xs:attribute>
	</xs:complexType>
	<xs:complexType name="sectionsType">
		<xs:sequence>
			<xs:element type="sectionType" name="section" maxOccurs="unbounded" minOccurs="0">
				<xs:annotation>
					<xs:documentation>Section of story</xs:documentation>
				</xs:annotation>
			</xs:element>
		</xs:sequence>
	</xs:complexType>
	<xs:complexType name="storyType">
		<xs:sequence>
			<xs:element type="charactersType" name="characters" />
			<xs:element type="sectionsType" name="sections" />
		</xs:sequence>
		<xs:attribute type="xs:string" name="name" use="required">
			<xs:annotation>
				<xs:documentation>Text is android string reference and must have format "@string/text".</xs:documentation>
			</xs:annotation>
		</xs:attribute>
	</xs:complexType>
</xs:schema>
